Type	Veldnaam	Tabel	Afkorting	Kolom	Beschrijving	template:all	template:default	template:minimal
select	Sleutel	factResult	expr	concat(r.LimsAnalysisName, '__', r.Component, '__', r.TestReplicateCount, '__', r.ResultReplicate)	VERPLICHT	1	1	1
select	LimsStaalNummer	dimSample	s	LIMSSampleNumber	VERPLICHT BEHOUDEN: Intern staalnummer van het LIMS systeem	2	2	2
select	OrigineelStaal	dimSample	s	LIMSOriginalSampleNumber	VERPLICHT: De code waar alle resultaten van een staal in tercht komen	3	3	3
select	Project	factResult	r	Project	VERPLICHT: Projectnaam	4	4	4
select	LaboCode	dimSample	s	LabSampleID	De interne labocode van het staal	5	5	5
select	ContractID	dimContract	c	Contract	Contractnaam	6	6	
select	Klant	factResult	r	Customer	Identificatie van de klant	7	7	
select	VerantwoordelijkLabo	dimProject	p	ResponsibleLab	Labo verantwoordelijk voor de uitvoering of management met externen	8	8	
select	LaboLimsGroep	dimProject	p	ProjectGroupName	Veiligheidsgroep voor het LIMS systeem	9		
select	ExternSampleID	dimSample	s	FieldSampleID	Veldcode voor een staal die de klant meegeeft aan het labo	10	9	6
select	SampleProduct	dimSample	s	Product	Product zoals gedefinieerd in het LIMS	11	10	
select	ProductGrade	dimSample	s	MatrixDetail	Detailomschrijving staal	12	11	
select	SamplingPoint	dimSample	s	SamplingPoint	Extra omschrijving staal	13	12	
select	Matrix	dimSample	s	Matrix	Matrix hoe het staal in het labo verwerkt wordt	14	13	
select	Monsternamedatum	dimSample	s	FieldSamplingDate	Staalnamedatum	15	14	
select	Monsternemer	dimSample	s	FieldObserver	Wie heeft het staal genomen in het veld	16	15	
select	Toestand	dimSample	s	SampleCondition	Toestand van het staal (vooral homogeniteit)	17	16	
select	VoorbehandelingExtern	dimSample	s	SamplePreparation	Hoe is het staal extern voorbehandeld voor het in het labo terecht kwam	18	17	
select	Opmerking	dimSample	s	FieldSampleRemark	Opmerking van het labo over het staal  	19	18	
select	LimsAnalyseNaam	factResult	r	LimsAnalysisName	Interne analysenaam in het LIMS systeem	20	19	7
select	LimsAnalyseVersie	dimAnalysis	a	AnalysisVersion	Analyseversie waarmee het staal is verwerkt	21	20	
select	SapCode	dimAnalysis	a	SAPcode	Verwijzing naar het analysesprotocol	22	21	
select	AnalyseNaam	dimAnalysis	a	AnalysisLabName	Analysenaam voor de wetenschappers	23	22	
select	Component	factResult	r	Component	Componentnaam van het resultaat	24	23	8
select	Gerapporteerd	factResult	r	IsReportable	Is het staal geschikt voor rapportage?	25	24	
select	TestReplicaat	factResult	r	TestReplicateCount	Hoeveelste replicate voor deze test is dit voor dit staal?	26	25	
select	ResultaatReplicaat	factResult	r	ResultReplicate	Hoeveelste replicate voor de individuele component is dit?	27	26	
select	ResultaatInstrument	factResult	r	Instrument	Instrument waarmee een component gemeten is (OPGELET: DIT ZAL WIJZIGEN NAAR TESTNIVEAU)	28	27	
select	TestInstrument	<<>>	<<>>	<<>>	Analysetoestel voor een meting (PAS OP: NOG NIET IN DWH)			
select	Batch	factResult	r	Batch	De batch waarin de test gemeten is	30	28	
select	BatchInstrument	dimBatch	b	BatchInstrument	Het instrument waarmee de batch gemeten is	31	47	
select	ResultaatType	factResult	r	ResultType	Resultaattype (Numeriek, Tekst, ...)	32	29	
select	Eenheid	dimUnit	u	Unit	Eenheid van het resultaat	33	30	
select	WaardeRuw	factResult	r	Result	Ruw resultaat in tekstvorm	34	31	9
select	WaardeGeformatteerd	factResult	r	ResultFormatted	Geformatteerd resultaat met afrondingen en rekening houden met LOQ	35	32	10
select	WaardeNumeriek	factResult	r	ResultNumeric	Numerieke waarde van het resultaat	36	33	
select	WaardeNumeriekGeformatteerd	factResult	r	ResultFormattedNumeric	Geformatteerde numerieke waarde, indien onder LOQ is dit <LOQ en niet ruwe waarde	37	34	
select	BinnenSpecs	factResult	r	IsInSpec	Viel het binnen de specificatie van de analyse?	38		
select	BenedenLOQ	factResult	r	isBelowLOQ	Is het resultaat onder de minimum LOQ?	39	35	11
select	BovenMaxLOQ	factResult	r	IsAboveLOQ	Is het resultaat boven de maximum LOQ?	40		
select	VisueleMatrix	dimSample	s	VisualMatrix	Visuele beoordeling van de matrix door het labo	41	37	
select	Plaat	dimSample	s	samplePlate	Plaatnaam waar het staal op terecht komt	42	38	
select	PlaatPositie	dimSample	s	SamplePlatePosition	Positie op de plaat waar het staal staat	43	39	
select	ArchiefStaal	dimSample	s	IsArchiveSample	Is het een staal die gearchiveerd moet worden?	44	40	
select	Xcoord	dimSample	s	SampleLambertX	De X coordinaat van de veldmeting voor het staal	45	41	
select	Ycoord	dimSample	s	SampleLambertY	De Y coordinaat van de veldmeting voor het staal	46	42	
select	Diepte	dimSample	s	SampleDepth	De Diepte coordinaat van de veldmeting voor het staal	47	43	
select	Toponiem	dimSample	s	SampleToponym	Het toponiem coordinaat van de veldmeting	48	44	
select	StaalStatus	dimSample	s	SampleStatus	De status van het staal (A = goedgekeurd, X is gecanceld)	49	45	
select	ResultaatStatus	factResult	r	ResultStatus	De status van het resultaat (A = goedgekeurd, X is gecanceld)	50	46	
select	TestStatus	factResult	r	TestStatus	De status van de test	51		
select	ProjectOmschrijving	dimProject	p	ProjectDescription	Beschrijving van het project	52		
select	ProjectStatus	dimProject	p	ProjectStatus	De status van het project (A = goedgekeurd)	53		
select	IsLaatsteReplicaat	factResult	r	isLastResultReplicate	Is dit de laatste replicaat van het resultaat 	54		
tabel	StaalTabel	dimSample	s	dimSample s	De staaltabel is de asistabel waarmee de databank bevraging begint	101	101	101
tabel	ResultaatTabel	factResult	r	left join factResult r on r.SampleKey = s.SampleKey	De tabel met de resultaten	102	102	102
tabel	ProjectTabel		p	inner join dimProject p on r.ProjectKey = p.ProjectKey	De tabel met de projectinformatie	103	103	103
tabel	ContractTabel		c	inner join dimContract c on r.ContractKey = c.ContractKey	De tabel met de contractinformatie	104	104	104
tabel	AnalyseTabel		a	inner join dimAnalysis a on r.AnalysisKey = a.AnalysisKey	De tabel met de analyseinformatie	105	105	105
tabel	EenheidTabel		u	left join dimUnit u on r.UnitKey = u.UnitKey	De tabel met de eenheiden voor de testen	106	106	106
tabel	Batchtabel		b	left join dimBatch b on r.BatchKey = b.BatchKey	De tabel met de definitie van de batches	107	107	107
filter	Project		r	Project in <<PROJECTEN>>	De projecten worden ingevuld op het moment de data ingelezen wordt <<>> werdt vervangen\	151	151	151
filter	StaalGoedgekeurd		s	SampleStatus = 'A'	Enkel geauthoriseerde stalen	152	152	152
filter	ResultaatGoedgekeurd		r	ResultStatus= 'A'	Enkel geauthoriseerde resultaten	153	153	153
filter	ProjectGoedgekeurd		p	ProjectStatus = 'V'	Enkel geauthoriseerde projecten	154	154	154
filter	ResultaatGerapporteerd		r	IsReportable=1	Enkel resultaten die door het labo als rapporteerbaar gezet zijn	155	155	155
